"SHIUXT6G","journalArticle","2021","Ta, Son Xuat; Nguyen, Van Cuong; Nguyen, Khac Kiem; Dao‐Ngoc, Chien","Single‐feed slotted‐patch antenna loaded with metasurface for CubeSat applications.","International Journal of RF &amp; Microwave Computer-Aided Engineering","","1096-4290","","https://research.ebsco.com/linkprocessor/plink?id=5e9008d8-35cb-3d11-90bd-d6c68659102b","In this paper, a metasurface‐based antenna with broadband circularly polarized (CP) radiation is presented for S‐band CubeSat applications. It consists of a single‐feed slotted patch and a metasurface composed of 4 × 4 periodic metallic plates. The patch is sandwiched between the finite metasurface and ground plane to excite surface wave resonances for the broadband operation. The antenna is designed to achieve the geometry and characteristics, which are compatible with any CubeSat standard structure. The final prototype with an overall size of 0.64λmin × 0.64λmin × 0.026λmin (λmin is the free space wavelength referring to the lowest operational frequency) has been realized and tested. The experiments result in a |S11| &lt; −10 dB bandwidth of 24.64% (1.85‐2.37 GHz), an axial ratio &lt; 3‐dB bandwidth of 15.23% (1.94‐2.26 GHz), and a broadside realized gain of 5.6 to 6.7 dBic. Moreover, the antenna achieves a good broadside right‐hand CP radiation with symmetric pattern, high front‐to","2021","2025-11-07 22:19:19","2025-11-07 22:19:19","","1-10","","4","31","","","","","","","","","","","","","","","","","","","","","All other building equipment contractors; Antenna design; Antennas (Electronics); Broadband antennas; Circular polarization; CubeSats (Artificial satellites); Metamaterial antennas; Other Building Equipment Contractors; Other Electronic Parts and Equipment Merchant Wholesalers; Power and Communication Line and Related Structures Construction","","","","","","","","","","","","","","","","","","","","","","","","","","","","","","","","","","","","","","","","","","","","","","",""
"ZU7C6ET7","journalArticle","2022","Aguni, Lahcen; Chabaa, Samira; Ibnyaich, Saida; Sellak, Lahcen; Sarosh, Ahmad; Zeroual, Abdelouhab","A novel automatic‐dependent surveillance‐broadcast patch antenna for aircraft tracking.","Microwave &amp; Optical Technology Letters","","0895-2477","","https://research.ebsco.com/linkprocessor/plink?id=454883c0-dc0f-3505-97d9-07f5b48da1ec","This paper focuses on the design of a novel automatic‐dependent surveillance‐broadcast (ADS‐B) patch antenna operating at 1090 MHz with good bandwidth and good gain for aircraft tracking and navigation purposes. The structure of the proposed antenna consists of a long strip line ended by a crescent patch, a U‐shaped ground plane, and a rectangular substrate. The proposed antenna is simulated using both HFSS and CST electromagnetic simulators. The overall dimensions of the antenna are 130 × 26 × 1.6 mm3, and is fabricated on a low‐cost FR‐4 epoxy substrate. Various parameters are determined and analyzed to evaluate the antenna performance in terms of reflection coefficient, impedance bandwidth, radiation pattern, gain, and efficiency. It has been verified and tested that the simulated results are in very good agreement with the measured ones. At the desired frequency of 1090 MHz, the ADS‐B patch antenna has a gain of 2.23 dBi and a measured impedance bandwidth at −10 dB of 200 MHz. The","2022","2025-11-07 22:19:19","2025-11-07 22:19:19","","2213-2221","","12","64","","","","","","","","","","","","","","","","","","","","","All other building equipment contractors; Antennas (Electronics); Microstrip antennas; Nanosatellites; Omnidirectional antennas; Other Building Equipment Contractors; Other Electronic Parts and Equipment Merchant Wholesalers; Power and Communication Line and Related Structures Construction; Reflectance; Satellite Telecommunications; Surveillance radar; Telecommunication satellites","","","","","","","","","","","","","","","","","","","","","","","","","","","","","","","","","","","","","","","","","","","","","","",""
"PHRDNBX9","journalArticle","2019","Sitompul, Peberlin P.; Sumantyo, Josaphat T. Sri; Kurniawan, Farohaji; Santosa, Cahya Edi; Manik, Timbul; Hattori, Katsumi; Gao, Steven; Liu, Jann-Yenq","A Circularly Polarized Circularly-Slotted-Patch Antenna with Two Asymmetrical Rectangular Truncations for Nanosatellite Antenna.","Progress in Electromagnetics Research C","","19378718","","https://research.ebsco.com/linkprocessor/plink?id=fab99eeb-2c9e-399b-8522-d41ffab1f21c","In this paper, a circularly polarized slot-patch antenna for nanosatellite is presented. The novel design of the circularly polarized wave conducted by two asymmetrical rectangular-truncation techniques implemented on a circularly-slotted-patch on the front side and a deformed-shifted-feedline on the back side of the substrate. The antenna is printed on substrates with the dielectric constant of 2.17 and thickness of 1.6mm. The resonant frequency of the proposed antenna is set at 2.2 GHz with the minimum requirement of the axial ratio bandwidth (ARBW) of 300 MHz. The proposed antenna produces under 10 dB impedance bandwidth (IBW) 1.2765 GHz or equal to 58% (1.7235-3 GHz) with Left-Handed Circular Polarization (LHCP). The average antenna gain reaches 4.5 dBic at 2.2 GHz and the ARBW 327.5MHz or about 14.88% (2.0275-2.355 GHz). This paper includes the description and presentation of the completed discussion.","2019","2025-11-07 22:19:19","2025-11-07 22:19:19","","225-236","","null","90","","","","","","","","","","","","","","","","","","","","","All other building equipment contractors; Antennas (Electronics); Circular polarization; Other Building Equipment Contractors; Other Electronic Parts and Equipment Merchant Wholesalers; Permittivity; Power and Communication Line and Related Structures Construction","","","","","","","","","","","","","","","","","","","","","","","","","","","","","","","","","","","","","","","","","","","","","","",""
"4S24EW92","journalArticle","2024","Govathoti, Prudhvi Raj; Phaneendra, Chirukuri Naga; Naik, Ketavath Kumar","Design of Wider Impedance Bandwidth with Dual-Port CPW-Fed Slotted Patch Antenna for Wireless Communications.","Progress in Electromagnetics Research C","","19378718","","https://research.ebsco.com/linkprocessor/plink?id=5f17c686-8571-3919-a00b-82b7fc8ebad8","A novel dual-port co-planar wave-guide (CPW)-fed rectangular patch (CRSP) antenna with L-shape and rectangular-shaped slots is proposed for wider impedance bandwidth for wireless communications applications. The dimensions of the overall proposed patch antenna are compact, with a size of 20×40×0.07 mm3. It operates from 14.6 GHz to 17.4 GHz with an impedance bandwidth of 2.8 GHz. The isolation between elements is greater than 15 dB within the band. A peak gain of 6.74 dBi and a reflection coefficient of -30 dB at operating frequency have been observed. The two-port (multiple-input and multiple-output) CPW-fed antenna parameters like envelope correlation coefficient (ECC), diversity gain (DG), total active reflection coefficient (TARC), channel capacity loss (CCL), and mean effective gain (MEG) are investigated. The simulated and measured characteristics are found to be satisfactory for CRSP antenna model utilized for wireless communication applications.","2024","2025-11-07 22:19:19","2025-11-07 22:19:19","","33-41","","null","144","","","","","","","","","","","","","","","","","","","","","All other building equipment contractors; Antennas (Electronics); Bandwidths; Nanosatellites; Other Building Equipment Contractors; Other Electronic Parts and Equipment Merchant Wholesalers; Power and Communication Line and Related Structures Construction; Radio and Television Broadcasting and Wireless Communications Equipment Manufacturing; Reflectance; Satellite Telecommunications; Slot antennas; Telecommunication satellites; Wireless communications; Wireless Telecommunications Carriers (except Satellite)","","","","","","","","","","","","","","","","","","","","","","","","","","","","","","","","","","","","","","","","","","","","","","",""
"XQLITCII","journalArticle","2015","Islam, M. T.; Cho, Mengu; Samsuzzaman, M.; Kibria, S.","Compact Antenna for Small Satellite Applications [Antenna Applications Corner].","IEEE Antennas &amp; Propagation Magazine","","10459243","","https://research.ebsco.com/linkprocessor/plink?id=651fd221-a84d-3a1a-bd0f-39386ff8ec52","???The combined effort of the Universiti Kebangsaan Malaysia and the Kyushu Institute of Technology (KYUTECH) to develop a small-satellite antenna is presented in this paper. Microstrip antennas offer an ideal solution to satellite communication requirements due to their light weight and low profile. In this paper, a compact single-layer coaxial-probe-fed circularly polarized high-gain patch antenna designed for HORYU-IV nanosatellite S-band communication is presented. HORYU-IV aims to acquire data about high-voltage discharge phenomena in low Earth orbit (LEO). This will enhance the understanding of satellite charging, and overall satellite reliability can be improved for future high-power space programs. The proposed antenna consists of four asymmetric V-shaped slits, i.e., one at each corner of a rectangular patch, and a parasitic rectangular strip. The proposed antenna achieves a sufficient beamwidth for LEO satellite application and less than 3-dB axial ratio for the entire field","2015","2025-11-07 22:19:19","2025-11-07 22:19:19","","30-36","","2","57","","","","","","","","","","","","","","","","","","","","","construction; Low earth orbit satellites; Malaysia); Microspacecraft; Microstrip antenna design &amp; Nanosatellites; Satellite Telecommunications; Telecommunication satellites; Universiti Kebangsaan Malaysia (Bandar Baru Bangi","","","","","","","","","","","","","","","","","","","","","","","","","","","","","","","","","","","","","","","","","","","","","","",""
"LHISW6BX","journalArticle","2025","Yoo, Jengsu; Lee, Myung Lae; Yang, Yong Suk","3D printed and circularly polarized 28 GHz patch antenna array for small satellite communications.","Aerospace Science &amp; Technology","","1270-9638","","https://research.ebsco.com/linkprocessor/plink?id=78ccecf2-63b2-350e-984e-6a12b7799455","This paper presents the design, fabrication, and testing of a high-gain compact 2 × 2 circularly polarized patch antenna array using 3D printing technology for small satellite 5G communication at 28 GHz. The proposed antenna demonstrates high efficiency and a low profile, addressing the limitations in design flexibility associated with traditional PCB fabrication methods. The 2 × 2 array configuration, incorporating via fences, coaxial vertical feedlines, and a sequentially rotated phased feed network, enhances the antenna's bandwidth and axial ratio bandwidth while maintaining compactness, crucial for space-constrained satellite applications. Simulations optimized key antenna parameters, including reflection coefficient, gain, and axial ratio. Measurement results validated the simulations, showing an impedance bandwidth of 6.8 GHz and an axial ratio bandwidth of 3.1 GHz, with a peak gain of 6.33 dB. Thermal cycling and electrical tests ensured the antenna's durability in space enviro","2025","2025-11-07 22:19:19","2025-11-07 22:19:19","","N.PAG-N.PAG","","null","164","","","","","","","","","","","","","","","","","","","","","All other building equipment contractors; Antenna arrays; Antennas (Electronics); Microspacecraft; Other Building Equipment Contractors; Other Electronic Parts and Equipment Merchant Wholesalers; Power and Communication Line and Related Structures Construction; Satellite Telecommunications; Space environment; Telecommunication satellites","","","","","","","","","","","","","","","","","","","","","","","","","","","","","","","","","","","","","","","","","","","","","","",""
"C2JG8BF7","journalArticle","2021","Simon, Jorge; Perez-Guerrero, Hugo; Sosa-Pedroza, Jorge; Martínez-Zúñiga, Fabiola; Villanueva-Maldonado, Juvenal; Flores-Troncoso, Jorge; Cardenas-Juarez, Marco","Design of an Ultrawideband Circularly Polarized Printed Crossed-Dipole Antenna Based on Genetic Algorithms for S-Band CubeSat Applications.","International Journal of Antennas &amp; Propagation","","16875869","","https://research.ebsco.com/linkprocessor/plink?id=ec07f3dd-874b-3112-bcc0-3987cb28eee4","As in any satellite, onboard antennas for CubeSats are crucial to establish communication with ground stations or other satellites. According to its application, antennas must comply with standardized requirements related to size, bandwidth, operating frequency, polarization, and gain. This paper presents an ultrawideband circularly polarized two-layer crossed-dipole microstrip antenna for S-band CubeSat applications using genetic algorithms optimization tools included in the 3D electromagnetic simulation software Ansys HFSS. The antenna is constructed on a 10 × 10 cm Cuclad-250 substrate with a back copper flat plane, located at λ/4 at 2.25 GHz operating frequency. The backplane with the exact substrate dimensions improves gain and reduces inside satellite radiation. Measured bandwidth defined by S<sub>11</sub> at a −10 dB was higher than 1835 MHz with S<sub>11</sub> = −24.68 dB at the central frequency of 2.25 GHz, while measured VSWR at the same frequency was 1.124. At 2.25 GHz, th","2021","2025-11-07 22:19:19","2025-11-07 22:19:19","","1-13","","null","null","","","","","","","","","","","","","","","","","","","","","All other building equipment contractors; Antennas (Electronics); CubeSats (Artificial satellites); Dipole antennas; Earth stations; Genetic algorithms; Microstrip antennas; Other Building Equipment Contractors; Other Electronic Parts and Equipment Merchant Wholesalers; Power and Communication Line and Related Structures Construction; Satellite Telecommunications","","","","","","","","","","","","","","","","","","","","","","","","","","","","","","","","","","","","","","","","","","","","","","",""
"YITNEBNL","journalArticle","2024","Osipova, Ksenia; Camps, Adriano; Golkar, Alessandro; Ruiz-de-Azua, Joan A.; Fernandez, Lara; Garzaniti, Nicola","Architecting CubeSat constellations for messaging service, Part I.","Acta Astronautica","","0094-5765","","https://research.ebsco.com/linkprocessor/plink?id=68ec0a92-45e0-31b6-9171-ec039ca8a783","In today's modern and globalized world, connectivity is a key factor for businesses, production facilities, sensor networks, and ordinary people. However, there are still populated areas which are not covered by ground-based telecommunications infrastructure. This is where telecommunication satellite constellations come in, as they can provide coverage to remote and uninhabited regions and fill existing connectivity gaps to ensure data transfer. LoRa is one of the technologies designed for data transmissions over long distances with low power consumption. Alongside with other technologies of the Low-Power Wide Area Network family, it is widely used for Internet of Things applications. LoRa chirp spread spectrum modulation is robust against the Doppler frequency shifts encountered in low earth orbits, and it has already been used in IoT satellite communications. Due to the low transmitted signal power, the achieved data rate is not high, making it a suitable technology for telecommunic","2024","2025-11-07 22:19:19","2025-11-07 22:19:19","","525-539","","null","223","","","","","","","","","","","","","","","","","","","","","Channel capacity (Telecommunications); Communication infrastructure; Doppler effect; Electronic components; navigational and communications equipment and supplies merchant wholesalers; Satellite Telecommunications; Telecommunication satellites; Telecommunication systems; Transmitters (Communication); Wide area networks","","","","","","","","","","","","","","","","","","","","","","","","","","","","","","","","","","","","","","","","","","","","","","",""
"6P6NREWB","journalArticle","2012","Rodriguez-Osorio, Ramon Martinez; Ramírez, Enrique Fueyo","A Hands-On Education Project: Antenna Design for Inter-CubeSat Communications [Education Column].","IEEE Antennas &amp; Propagation Magazine","","10459243","","https://research.ebsco.com/linkprocessor/plink?id=5ad28b8f-3441-30b7-a91f-88cef271c422","CubeSat platforms have become a de facto standard for universities willing to initiate space-technology activities with students. These small satellite platforms ease the implementation of hands-on education projects and opening the apertures of new research areas. Moreover, due to the limited volume (a 10 cm cube) and power (1 W), the application of imaginative solutions is mandatory. This leads to new innovation processes in the course of CubeSat projects. In this paper, we present a hands-on education project the aim of which is the specification, design, building and measurement of an antenna for communication between nanosatellites and, in particular, CubeSats. The project lies within the framework of ETSIT-UPM innovative education activities in the area of space technology, where students play a leading role in real engineering projects.","2012","2025-11-07 22:19:20","2025-11-07 22:19:20","","211-224","","5","54","","","","","","","","","","","","","","","","","","","","","and Professional Schools; Antenna arrays; Astronautics; colleges; Colleges; Electrical engineering education; Engineering Services; Innovations in higher education; Satellite Telecommunications; Space Research and Technology; Students; Telecommunication satellites; Universities; Universities &amp","","","","","","","","","","","","","","","","","","","","","","","","","","","","","","","","","","","","","","","","","","","","","","",""
"LH947MFZ","journalArticle","2015","Volkan, A. K. A. N.","Electrically small printed antenna for applications on cubesat and nano-satellite platforms.","Microwave &amp; Optical Technology Letters","","0895-2477","","https://research.ebsco.com/linkprocessor/plink?id=e57bd6b7-5f2f-396b-bb82-18afab17b1dc","ABSTRACT A very compact circularly polarized antenna to be utilized readily on nanosatellite and CubeSat platforms is presented. Nanosatellite and CubeSats have very limited volume and surfaces bringing a physical size constraint on the components and antennas which should also be as functional as their counterparts used in similar terrestrial systems. The proposed structure is a cavity-backed antenna with tapered crossed-slot aperture. The antenna is a low-profile compared to wavelength, circularly polarized and wide-band with respect to conventional high-Q printed antennas. Two different designs to operate at 2.44 GHz are implemented on two different substrates, occupying a footprint of 38 mm × 38 mm and 30 mm × 30 mm. Their measured percentage impedance bandwidths are 2% and 1.68%, respectively. The obtained maximum gain is about 5 dBic around the target frequency. © 2015 Wiley Periodicals, Inc. Microwave Opt Technol Lett 57:891-896, 2015","2015","2025-11-07 22:19:20","2025-11-07 22:19:20","","891-896","","4","57","","","","","","","","","","","","","","","","","","","","","Aerospace product and parts manufacturing; Circular polarization; CubeSats (Artificial satellites); Guided Missile and Space Vehicle Manufacturing; Nanosatellites; Slot antennas; Space vehicles; Transportation Equipment and Supplies (except Motor Vehicle) Merchant Wholesalers","","","","","","","","","","","","","","","","","","","","","","","","","","","","","","","","","","","","","","","","","","","","","","",""
"DANRJK37","journalArticle","2020","Suarez Fajardo, Carlos Arturo; Ariza Pulido, Jeison Jair; Mejía Serrano, Sergio Esteban; Puerto Leguizamón, Gustavo Adolfo","Suspended plate antenna with circular polarization and configurable sense of rotation.","Inge-Cuc","","0122-6517","","https://research.ebsco.com/linkprocessor/plink?id=d8aea590-976b-3ad1-b696-1d2239186f1d","Introducción: Las antenas con polarización circular (APC) permiten reducir el efecto de rotación de Faraday debido a la presencia de la ionosfera, el cual ocasiona una significante pérdida de potencia frente al caso de utilizar antenas con polarización lineal (ALP) [1]-[2], por lo tanto, estas antenas son ampliamente utilizadas para aplicaciones en telemetría espacial de satélites, sondas espaciales y misiles balísticos entre otras [2]. Por otra parte, las antenas de placa suspendida (APS) brindan la posibilidad de obtener mayores niveles de ganancia máxima y ancho de banda de impedancia frente a las tecnologías convencionales. Así mismo, resulta útil el poder seleccionar el sentido de giro más apropiado, dependiendo de las condiciones de propagación en los enlaces de subida/bajada. Objetivo: Diseñar una (APC) con sentido de giro seleccionable para aplicaciones en satélites pequeños, usando la tecnología (APS), tal que posea niveles de ganancia y ancho de banda superiores a las obteni","2020","2025-11-07 22:19:20","2025-11-07 22:19:20","","1-10","","1","16","","","","","","","","","","","","","","","","","","","","","ANTENNAS (Electronics); CIRCULAR polarization; FARADAY effect; LINEAR polarization; ROTATIONAL motion; ℡ECOMMUNICATION satellites; ℡EMETRY","","","","","","","","","","","","","","","","","","","","","","","","","","","","","","","","","","","","","","","","","","","","","","",""
"MVX7V9F7","journalArticle","2019","Yoshimoto, Eduardo; Heckler, Marcos V. T.","Optimization of Planar Antenna Arrays Using the Firefly Algorithm.","Journal of Microwaves, Optoelectronics &amp; Electromagnetic Applications","","21791074","","https://research.ebsco.com/linkprocessor/plink?id=cd074d8a-4249-3a19-9a51-7e5cdf304ba6","This paper describes the application of the Firefly Algorithm for the optimization of linear and planar antenna arrays. In order to demonstrate the potential of this technique, three applications are reported. The first one is the synthesis of a radiation pattern with isoflux distribution with a non-uniformly spaced linear array composed of isotropic antennas. The second application is the optimization of a non-uniformly spaced planar array composed of isotropic radiators installed on an 8-U nanosatellite. Finally, the optimization of a 3×3 planar antenna array for beam steering with simultaneous side lobe level control is described, whereby the beamforming coefficients were allowed to assume only discrete values. In the three cases considered, good agreement between the desired (mask) and the optimized patterns has been obtained.","2019","2025-11-07 22:19:20","2025-11-07 22:19:20","","126-140","","1","18","","","","","","","","","","","","","","","","","","","","","Beam steering; Directional antennas; Linear antenna arrays; Planar antenna arrays; Process optimization; Space (Architecture)","","","","","","","","","","","","","","","","","","","","","","","","","","","","","","","","","","","","","","","","","","","","","","",""
"Z8GYFQVN","journalArticle","2019","Sitompul, Peberlin Parulian; Sri Sumantyo, Josaphat Tetuko; Kurniawan, Farohaji; Nasucha, Mohammad","Axial Ratio and Gain Enhancement of a Circular-Ring Slot Antenna Using a Pair of Asymmetrical Rectangular Slots and a Parasitic Patch for a Radio Beacon on a Nanosatellite.","Aerospace (MDPI Publishing)","","22264310","","https://research.ebsco.com/linkprocessor/plink?id=7b70007e-777e-375b-a829-bb1dbab62b1a","Radio beacons enable measurements of ionospheric radio scintillations and total electron content (TEC). These beacons transmit unmodulated, phase-coherent waves in S-band frequencies. Many satellite applications require circularly polarized (CP) wideband antennas. Their compact size, lightweight, and simple fabrication method make CP antennas suitable for small satellite systems. The slot antenna has wideband impedance, but the 3 dB axial ratio bandwidth (ARBW) is narrower compared to the impedance bandwidth (IBW). In this paper, a circularly polarized circular-slotted antenna (CSA) is proposed to enhance the ARBW and the antenna gain. A pair of asymmetrical rectangular slots, a simple 50 Ω feedline and a parasitic patch were introduced to a CSA to enhance the 3 dB ARBW and the antenna gain. Rectangular slots were inserted on the diagonal axis of the CSA, the feedline was shifted to the left side of the x-axis, and a parasitic patch was attached to the circular slot. The lengths of th","2019","2025-11-07 22:19:20","2025-11-07 22:19:20","","39-null","","4","6","","","","","","","","","","","","","","","","","","","","","Aspect ratio (Images); Beacons; Circular polarization; Ionospheric techniques; Radio measurements; Slot antennas","","","","","","","","","","","","","","","","","","","","","","","","","","","","","","","","","","","","","","","","","","","","","","",""
