"VDX6R5LL","journalArticle","2021","Мейрамбекулы, Н.; Карибаев, Б. А.; Темирбаев, А. А.; Иманбаева, А. К.","S-И X-ДИАПАЗОННАЯ ПАТЧ-АНТЕННА ДЛЯ НАНОСПУТНИКОВ CUBESAT.","Recent Contributions to Physics","","1563-0315","","https://research.ebsco.com/linkprocessor/plink?id=288e9afd-bec8-3045-8c25-51decde812e7","The CubeSat concept has become very popular with both university groups and researchers, space agencies, governments and companies. CubeSat offers a fast and affordable way for a wide range of stakeholders to be active in space. Due to the high degree of modularity and widespread use of offtheshelf commercial subsystems, CubeSat projects can be prepared for flight much faster than using traditional satellite schedules usually within one to two years. In this paper, we have considered a model of an S and X band patch antenna for CubeSat nanosatellites in the field of Earth remote sensing (ERS). The antenna dimensions were determined and designed according to the dimensions of the small spacecraft. The shape of the emitting part was formed using a geometric fractal with an anisotropic structure. Using the CST Microwave Studio software package, the electrodynamic, frequency characteristics and directional properties of the antenna were determined. The results of computer simulations demo","2021","2025-11-07 22:19:19","2025-11-07 22:19:19","","90-96","","3","78","","","","","","","","","","","","","","","","","","","","","","","","","","","","","","","","","","","","","","","","","","","","","","","","","","","","","","","","","","","","","","","","","","","",""
"7IE79VF6","journalArticle","2020","Abbasi, M.A.B.; Fusco, V.F.; Naeem, U.","Communication to a spinning CubeSat using a two‐mode planar circular array.","Electronics Letters (Wiley-Blackwell)","","00135194","","https://research.ebsco.com/linkprocessor/plink?id=e8bb9ddc-8c55-3509-9ae2-db621c3d8690","This Letter presents a novel technique for establishing a robust communication link to a spinning un‐stabilised small satellite such as a CubeSat. The authors propose a system that involves a multimode excited planar circular array radio combined with a 360° phase shifter that can electronically track the spinning CubeSat antenna and establish a communication link. The transmitter comprises a mode‐generating Rotman lens and a circular array of microstrip patch antennas. The authors' proposed approach combines two spatially orthogonal modes of the circular array. They first present the system architecture, then they design and realise a proof‐of‐concept experimentally validated module operating in C‐band at 5.8 GHz.","2020","2025-11-07 22:19:19","2025-11-07 22:19:19","","519-521","","10","56","","","","","","","","","","","","","","","","","","","","","","","","","","","","","","","","","","","","","","","","","","","","","","","","","","","","","","","","","","","","","","","","","","","",""
"N7MYJ5IM","journalArticle","2022","DiCarlofelice, Alessandro; DiGiampaolo, Emidio; Tognolatti, Piero","A Numerical Procedure to Design a UWB Aperture-Coupled Microstrip Antenna Suitable for Space Applications.","Applied Sciences (2076-3417)","","20763417","","https://research.ebsco.com/linkprocessor/plink?id=5587adea-9d8e-3af2-9233-2f9c5a1c2098","In this paper, we show a dual-polarized ultra-wideband aperture-coupled microstrip antennae (ACMA) to be used in space missions such as CubeSat Ka-band applications. We also report the specific developed design procedure, which is distinguished from other design procedures by minimizing the complexity of construction, since it utilizes a simple multilayer structure without interlayer interconnections or inclusions. This design procedure develops an architecture for ACMA with the main objective of minimizing costs in large-scale production. The design starts from assigned specifications in terms of fractional bandwidth constrained to be larger than 40%, return loss better than 10 dB, and polarization purity and polarization isolation better than 25 dB, using materials with adequate ohmic and dielectric losses. A frequency-scaled prototype has been also designed, realized, and measured. Good agreement between the simulation and measurement results has been obtained.","2022","2025-11-07 22:19:19","2025-11-07 22:19:19","","11243-null","","21","12","","","","","","","","","","","","","","","","","","","","","Aperture antennas; Aperture-coupled microstrip antennas; CubeSats (Artificial satellites); Dielectric loss; Industrial costs","","","","","","","","","","","","","","","","","","","","","","","","","","","","","","","","","","","","","","","","","","","","","","",""
"PBGXBIYW","journalArticle","2023","Fernandez, Lara; Munoz-Martin, Joan Francesc; Ruiz-de-Azua, Joan A.; Calveras, Anna; Camps, Adriano","Design and validation of a dual-band circular polarization patch antenna and stripline combiner for the FSSCat mission.","Acta Astronautica","","0094-5765","","https://research.ebsco.com/linkprocessor/plink?id=4c149f19-b02d-32d0-bef2-077a5aec7319","The FMPL-2 payload on board the 3 Cat-5/A 6 Unit CubeSat, part of the FSSCat CubeSat mission, includes a dual L-Band Microwave Radiometer and a Global Navigation Satellite System Reflectometer, in one instrument, implemented in a Software Defined Radio. One of the design challenges of this payload was its Nadir looking Antenna, which had to be directive (&gt; 12 dB), dual-band at 1400–1427 MHz and 1575.42 MHz, left-hand circularly polarized, and with important envelope restrictions, notably with a low profile. After a trade-off analysis, the best design solution appeared to be an array of six elements each of them being a stacked dual-band patch antenna, with diagonal feed to create the circular polarization, and a six to one stripline combiner. The design process of the elementary antennas first includes a theoretical analysis, to obtain the approximate dimensions. Then, by means of numerical simulations, prototyping, and adjusting the results in the simulations, the manufacturing er","2023","2025-11-07 22:19:19","2025-11-07 22:19:19","","194-204","","null","208","","","","","","","","","","","","","","","","","","","","","All other building equipment contractors; Antennas (Electronics); Circular polarization; Global Positioning System; Microstrip antennas; Microwave radiometers; Multifrequency antennas; Other Building Equipment Contractors; Other Electronic Parts and Equipment Merchant Wholesalers; Power and Communication Line and Related Structures Construction; Wireless LANs","","","","","","","","","","","","","","","","","","","","","","","","","","","","","","","","","","","","","","","","","","","","","","",""
"LINY6HLF","journalArticle","2022","Paul, Kajol Chandra; Ahmed, Anis","E-shaped Aperture Coupled Microstrip Patch Array Antenna for High Speed Downlink Applications in Small Satellites.","International Journal of Electronics &amp; Telecommunications","","2081-8491","","https://research.ebsco.com/linkprocessor/plink?id=48a34426-b60d-3f69-8663-58af93f6393e","For high speed downlinking of payload data from small satellites, a new 4x4 aperture coupled microstrip patch array antenna has been presented. The antenna is designed for the Ku band and a peak gain of 18.0 dBi is achieved within the impedance bandwidth from 11.75 GHz to 12.75 GHz. Wide bandwidth is achieved as the patch elements are excited through E-shaped slots having asymmetric side lengths and widths. Each square patch element of the array with truncated corners and appropriately placed slots generates right hand circularly polarized (RHCP) radiation with very high crosspolarization discrimination. A corporate feed network consisting of T-junctions and quarter-wave impedance transformers is developed to feed the array elements from a single coaxial port of 50 Ω. To improve the radiation from the patches and waveguiding in the feed network, two types of Rogers substrates with different dielectric constant and thickness are considered. Our proposed microstrip patch array antenna o","2022","2025-11-07 22:19:19","2025-11-07 22:19:19","","47-56","","1","68","","","","","","","","","","","","","","","","","","","","","Aperture-coupled microstrip antennas; Circular polarization; Microspacecraft; Microstrip antenna arrays; Permittivity","","","","","","","","","","","","","","","","","","","","","","","","","","","","","","","","","","","","","","","","","","","","","","",""
"N67KKUIC","journalArticle","2018","Lee, Sunghee; Pyo, Seongmin; Kim, Jae‐Hyun","Dual‐band bidirectional circularly polarized microstrip antenna for CubeSat system.","Microwave &amp; Optical Technology Letters","","0895-2477","","https://research.ebsco.com/linkprocessor/plink?id=5730af0c-1089-3352-a4f5-b4809ed5adbe","This article proposes a novel dual‐band bidirectional microstrip antenna with an identical right‐handed circularly polarized sense for a CubeSat system application. The asymmetrical arrow‐ended cross slot embedded only on the ground layer is dually utilized as the backward slot antenna at 1.575 GHz and the perturbing element of the microstrip antenna with forward radiations at 2.23 GHz. The implemented antenna successfully demonstrates dual‐band bidirectional right‐handed circular polarizations in good agreement with the simulation results for the global positioning system and the satellite telemetry of a CubeSat system.","2018","2025-11-07 22:19:19","2025-11-07 22:19:19","","2989-2992","","12","60","","","","","","","","","","","","","","","","","","","","","All other building equipment contractors; Antennas (Electronics); Bandwidths; Broadband antennas; Microstrip antennas; Other Building Equipment Contractors; Other Electronic Parts and Equipment Merchant Wholesalers; Power and Communication Line and Related Structures Construction; Radio and Television Broadcasting and Wireless Communications Equipment Manufacturing; Wireless communications; Wireless Telecommunications Carriers (except Satellite)","","","","","","","","","","","","","","","","","","","","","","","","","","","","","","","","","","","","","","","","","","","","","","",""
"Q5QXCUSL","journalArticle","2020","Platero, Valorie; Ferguson, Philip; Jayaraman, Raghavan; Isleifson, Dustin","2-In-1 smart panels: Embedding phased array patch antennas within satellite structures.","Acta Astronautica","","0094-5765","","https://research.ebsco.com/linkprocessor/plink?id=4fe3843b-5d74-3f3a-b9ae-0f96b1d41832","The increasing commercialization of space missions call for versatile subsystems that make efficient use of limited spacecraft volumes. Smart panel technology that provides both mechanical and electrical functionality is a beneficial solution to spacecraft miniaturization. Combining different subsystems that are usually developed independently of each other is an innovative approach to space system design. Embedding antennas within satellite structural components reduces the overhead required for integrating numerous systems and maximizes space for the payload and other critical instruments. Microstrip patch antennas provide a low profile, light weight, small-dimension and easily manufactured solution to small satellite communication. The phased array functionality of the antenna enables dynamic beamforming for maximum versatility. In this paper, we evaluate the feasibility of an embedded phased array microstrip patch antenna with a hybrid composite structural panel comprised of carbo","2020","2025-11-07 22:19:19","2025-11-07 22:19:19","","51-56","","null","175","","","","","","","","","","","","","","","","","","","","","Adaptive antennas; Directional antennas; IEEE 802.16 (Standard); Microstrip antenna arrays; Phased array antennas; Planar antenna arrays; Satellite Telecommunications; Telecommunication satellites","","","","","","","","","","","","","","","","","","","","","","","","","","","","","","","","","","","","","","","","","","","","","","",""
"NWPCH4AA","journalArticle","2018","Lee, Sunghee; Pyo, Seongmin; Kim, Jae‐Hyun","Circularly polarized microstrip antenna with bidirectional radiation using dual‐layered arrow‐shape slot perturbation for CubeSat application.","Microwave &amp; Optical Technology Letters","","0895-2477","","https://research.ebsco.com/linkprocessor/plink?id=2f142b7d-66f7-3933-8c0c-fa1937f339f8","Abstract: This article proposes a novel circularly polarized microstrip antenna supported with bidirectional opposite‐sense radiation using a dual‐layered arrow‐shaped slot perturbation. Unlike a conventional perturbation which is etched only on one side, the arrow‐shaped slot perturbation of the proposed antenna is divided into two diagonal half‐arrows and etched on both the top and bottom side. Consequently, the counter‐clockwise rotation of electric surface currents at the radiator side for right‐handed circular polarization and the clockwise rotation of those at the ground side for left‐handed circular polarization are successfully achieved. The measurement results of the proposed antenna show good agreement with the simulations of reflection coefficients, axial ratios, antenna gains, and radiation patterns.","2018","2025-11-07 22:19:19","2025-11-07 22:19:19","","2018-2022","","8","60","","","","","","","","","","","","","","","","","","","","","CubeSats (Artificial satellites); Microstrip antennas; Perturbation theory; Polarization (Electricity); Slot antennas","","","","","","","","","","","","","","","","","","","","","","","","","","","","","","","","","","","","","","","","","","","","","","",""
"EDFS4TYC","journalArticle","2017","Suárez-Fajardo, Carlos A.; Martín-Jackson, Cristiam D.; Puerto-Leguizamón, Gustavo A.","Antena de Parche Cortocircuitado con Polarización Circular y Sentido de Giro Reconfigurable para Aplicaciones en Satélites de Reducido Tamaño.","Información Tecnológica","","0716-8756","","https://research.ebsco.com/linkprocessor/plink?id=1576e6ef-6f98-3758-917c-4ce3c1da0694","This paper presents the design and characterization of a circular microstrip patch antenna, fed by a hybrid quadrature coupler to achieve reconfigurable circular polarization. The radiating element has a radius of 20.3mm and the overall dimensions of the antenna are 76mm x 76mm X 2.03mm, suitable to attaching it to one of the faces of a satellite (CubeSat 1U). The measurement results of the prototype show a maximum gain of G<sub>0</sub> = 6,04dBi and axial ratio bandwidth of 48.56MHz (2%) respect to 2dB at the center frequency of f<sub>0</sub> = 2,44GHz; an impedance bandwidth of 27.44% respect to the magnitude of the reflection coefficient of S<sub>11</sub> &lt; -10 dB, in the range of 2,295GHz to 3,025GHz at the center frequency of f<sub>0</sub> = 2,44GHz.","2017","2025-11-07 22:19:19","2025-11-07 22:19:19","","125-132","","6","28","","","","","","","","","","","","","","","","","","","","","","","","","","","","","","","","","","","","","","","","","","","","","","","","","","","","","","","","","","","","","","","","","","","",""
"PEJSMHW9","journalArticle","2025","Fitzpatrick, David J.; Palo, Scott E.","Innovative Systems Engineering Solutions for Power-Positive Operations: Navigating the Multi-Constraint Challenges of the SWARM-EX CubeSat Mission.","Advances in Space Research","","0273-1177","","https://research.ebsco.com/linkprocessor/plink?id=daee6df1-ccce-311c-849b-7190cebafdc4","Although the small stature of CubeSats and their standardized deployer options help to lower unit development cost and facilitate launch opportunities, the physical size limits of CubeSats prove to be a double-edged sword vis-à-vis sustaining a stable power state while hosting instruments with high power demands and often strict pointing requirements. For the Space Weather Atmospheric Reconfigurable Multiscale-EXperiment (SWARM-EX), this issue is magnified by the mission's ambitious goals; to comply with mission requirements, a SWARM-EX spacecraft is required to concurrently (1) point the science instruments no more than 30 ° off ram when they are operational, (2) point the GPS patch antenna no more than 30 ° off zenith at least once per orbit, (3) point the boresight of the X-Band patch antenna no more than 18 ° from the ground station during downlink, (4) maximize the differential cross-sectional area during differential drag maneuvers, and (5) maximize solar array power generation","2025","2025-11-07 22:19:19","2025-11-07 22:19:19","","6847-6862","","9","75","","","","","","","","","","","","","","","","","","","","","Electronic components; equipment and supplies merchant wholesalers; instruments; Microspacecraft; navigational and communications equipment and supplies merchant wholesalers; Other Electronic Parts and Equipment Merchant Wholesalers; Power and Communication Line and Related Structures Construction; Professional machinery; Scientific apparatus &amp; Semiconductor and other electronic component manufacturing; Semiconductor and Related Device Manufacturing; Short stature; Solar cells; Space environment","","","","","","","","","","","","","","","","","","","","","","","","","","","","","","","","","","","","","","","","","","","","","","",""
"8CY9TDZ6","journalArticle","2024","Nguyen, Ngoc-Lan; Bui, Cong Danh; Quang, Sang Nguyen; Duy, Tran Trung; Nguyen, Tan N.; Tu, Lam-Thanh","A Stacked Planar Antenna Array with Frequency Selective Surface for Downlink Applications of Small Satellites.","IETE Journal of Research","","03772063","","https://research.ebsco.com/linkprocessor/plink?id=0305d797-b489-3a50-9fd4-752ca5eb30e4","In this paper, a low-profile and broadband array antenna is proposed for satellite downlink applications. The proposed antenna is comprised of 4 × 4 elements, which are yielded for the downlink of the C band from 3.7 to 4.8 GHz. By arranging frequency selective surface (FSS) unit cells according to a new architecture, high directivity and broadband are provided, in which each element is covered by a lattice of 3 × 3 periodic metal plates. Based on RO4350B, the final design with a total size of 180 × 180 × 3.175 mm<sup>3</sup> (2.38λ × 2.38λ × 0.04λ at the lowest frequency of 3.97 GHz) has been fabricated, measured, and witnessed a broadband characteristic with S<sub>11</sub> &lt; −10 dB of 36% (3.97–5.5 GHz). In addition, the proposed antenna achieves a peak gain of 16 dBi and a radiation efficiency of 71%.","2024","2025-11-07 22:19:19","2025-11-07 22:19:19","","6115-6123","","7","70","","","","","","","","","","","","","","","","","","","","","Antenna arrays; Broadband antennas; Frequency selective surfaces; Planar antenna arrays; Unit cell","","","","","","","","","","","","","","","","","","","","","","","","","","","","","","","","","","","","","","","","","","","","","","",""
"V9LCTYH9","journalArticle","2023","Madany, Yasser M.; Elkamchouchi, Hassan M.; Abd-Elmonieum, Sara I.","High-Gain Pixel Patch Antenna Array for Miniature Wireless Communications and IoT Applications.","Progress in Electromagnetics Research C","","19378718","","https://research.ebsco.com/linkprocessor/plink?id=bf315630-4596-37f5-946d-3226863174a3","Since wireless technology has been developed so quickly, there is a surge in interest in multi-band reconfigurable antennas as devices and satellites continue to advance in the direction of downsizing. Due to physical limitations, current and future wireless technologies as well as the cutting-edge compact satellites need antenna systems that are dependable, effective, and have a large bandwidth. The fifth generation of mobile communication technology promises to deliver fast data rates, low latency, and exceptional spectrum efficiency. One of the most crucial factors that makes this technology possible is the way in which satellite technology is integrated with terrestrial communication systems. Therefore, it is crucially important to develop next-generation antennas that can meet the functional requirements for 5G and CubeSat applications. Additionally, the antenna components need to be small and low-profile for Advanced Driver-Assistance Systems (ADAS) and Vehicle-to-Everything (V2","2023","2025-11-07 22:19:19","2025-11-07 22:19:19","","209-225","","null","131","","","","","","","","","","","","","","","","","","","","","All other building equipment contractors; All Other Telecommunications; Antenna arrays; Antennas (Electronics); Beam steering; Communication Equipment Repair and Maintenance; Multifrequency antennas; Other Building Equipment Contractors; Other Electronic Parts and Equipment Merchant Wholesalers; Other telecommunications; Power and Communication Line and Related Structures Construction; Radio and Television Broadcasting and Wireless Communications Equipment Manufacturing; Satellite Telecommunications; Telecommunication; Telecommunication systems; Telecommunications Resellers; Wireless communications; Wireless Internet; Wireless Telecommunications Carriers (except Satellite)","","","","","","","","","","","","","","","","","","","","","","","","","","","","","","","","","","","","","","","","","","","","","","",""
"KLL2T5CD","journalArticle","2015","Samsuzzaman, M.; Islam, M. T.; Nahar, M. K.; Mandeep, J. S.; Mansor, F.; Islam, M. M.","Circularly polarized high gain S band antenna for nanosatellite.","International Journal of Applied Electromagnetics &amp; Mechanics","","1383-5416","","https://research.ebsco.com/linkprocessor/plink?id=0315cc41-22c4-3812-aa24-ab3f6baaa311","A circular polarized highly directional S band patch antenna for small satellite applications has been proposed in this invention. The proposed antenna comprises of a square ground plane and two circular radiating patches with annular circular slot fed by a coaxial probe. The circular slot in the radiating patch is responsible for creating resonance at the S band. The prototype is can be easily integrated with a small satellite due to the simplicity of the design. The modification of the circular shape patch by cutting circular shape slots help to excite the resonance at the desired frequency. The simulation and the experimental results have a good agreement. The proposed antenna has achieved an impedance bandwidth of 55 MHz (2.380 GHz-2.435 GHz) and axial ratio (AR) &lt; 3 dB is about 35 MHz (2.410 MHz-2.445 MHz) in the operating band. The prototype has achieved a gain of 8.13 dBi at centre frequency of 2.42 GHz. The directional radiation pattern, circular polarization (CP), and high","2015","2025-11-07 22:19:19","2025-11-07 22:19:19","","1039-1049","","4","47","","","","","","","","","","","","","","","","","","","","","Bandwidths; Circular polarization; Directional antennas; Electric impedance; Nanosatellites; Resonance frequency analysis","","","","","","","","","","","","","","","","","","","","","","","","","","","","","","","","","","","","","","","","","","","","","","",""
"VRP9F9M8","journalArticle","2021","디미트로브, 크리스티얀; 이용식; 윤성식; 조승주; 송찬미; 송성찬","위성 Synthetic-Aperture Radar (SAR) 시스템용 X-밴드 이중 편파 마이크로스트립 패치 부배열 안테나.","Journal of Korean Institute of Electromagnetic Engineering &amp; Science / Han-Guk Jeonjapa Hakoe Nonmunji","","12263133","","https://research.ebsco.com/linkprocessor/plink?id=9d63cab6-d737-387a-9bca-822a489b8a96","In this study, a high-performance, dual linearly polarized patch array antenna is presented for satellite synthetic aperture radar (SAR) applications. The antenna features an aperture-fed stacked patch as the radiation element and a stripline feeding network. A high-performance and low-loss dielectric substrate RF-35 by Taconic, and a honeycomb substrate is used. The honeycomb substrate is used to maximize the impedance bandwidth and decrease the insertion loss of the antenna. The proposed antenna offers exceptional isolation between the antenna’s ports in excess of 55 dB owing to its stripline feeding network. The via stitching technique is utilized to suppress the parallel-plate mode excited by the discontinuities in the stripline. The antenna is designed to possess a wide impedance bandwidth. A prototype antenna of size 2×4 elements, which operates in the X-band, is fabricated. Its impedance and radiation performance are experimentally verified, and the results are presented. The a","2021","2025-11-07 22:19:19","2025-11-07 22:19:19","","1031-1038","","12","32","","","","","","","","","","","","","","","","","","","","","All other building equipment contractors; Antenna arrays; Antenna design; Antennas (Electronics); Aperture antennas; Insertion loss (Telecommunication); Nanosatellites; Other Building Equipment Contractors; Other Electronic Parts and Equipment Merchant Wholesalers; Power and Communication Line and Related Structures Construction; Satellite Telecommunications; Synthetic aperture radar; Telecommunication satellites","","","","","","","","","","","","","","","","","","","","","","","","","","","","","","","","","","","","","","","","","","","","","","",""
